{"$schema":"https://json-schema.org/draft/2020-12/schema","$id":"ai-sdlc-upgrade-inventory/v1","type":"object","additionalProperties":false,"required":["schema","version","harness_api","files"],"properties":{"schema":{"const":"ai-sdlc-upgrade-inventory/v1"},"version":{"type":"string"},"harness_api":{"type":"object"},"files":{"type":"array","items":{"type":"object","additionalProperties":false,"required":["path","sha256","schema"],"properties":{"path":{"type":"string"},"sha256":{"type":"string","pattern":"^[a-f0-9]{64}$"},"schema":{"type":"string"}}}}}}
