{"schema":"ai-sdlc-upgrade-inventory/v1","version":"1.0.0","harness_api":{"min":"1.0.0","max_exclusive":"2.0.0"},"files":[{"path":"config/policy.json","sha256":"aaaaaaaaaaaaaaaaaaaaaaaaaaaaaaaaaaaaaaaaaaaaaaaaaaaaaaaaaaaaaaaa","schema":"policy/v1"},{"path":"skills/legacy/SKILL.md","sha256":"bbbbbbbbbbbbbbbbbbbbbbbbbbbbbbbbbbbbbbbbbbbbbbbbbbbbbbbbbbbbbbbb","schema":""},{"path":"skills/runtime/SKILL.md","sha256":"cccccccccccccccccccccccccccccccccccccccccccccccccccccccccccccccc","schema":"skill/v1"}]}
