{"schema":"ai-sdlc-upgrade-inventory/v1","version":"1.1.0","harness_api":{"min":"1.0.0","max_exclusive":"2.0.0"},"files":[{"path":"config/policy.json","sha256":"dddddddddddddddddddddddddddddddddddddddddddddddddddddddddddddddd","schema":"policy/v2"},{"path":"skills/new/SKILL.md","sha256":"eeeeeeeeeeeeeeeeeeeeeeeeeeeeeeeeeeeeeeeeeeeeeeeeeeeeeeeeeeeeeeee","schema":"skill/v1"},{"path":"skills/runtime/SKILL.md","sha256":"cccccccccccccccccccccccccccccccccccccccccccccccccccccccccccccccc","schema":"skill/v1"}]}
